{
  "$schema": "http://json-schema.org/draft-07/schema#",
  "title": "SurveySnapshot",
  "type": "object",
  "additionalProperties": false,
  "properties": {
    "schema_version": {
      "type": "string",
      "enum": [
        "0.1.0"
      ]
    },
    "title": {
      "type": "string",
      "minLength": 1
    },
    "entities": {
      "type": "array",
      "maxItems": 1000,
      "items": {
        "$ref": "#/$defs/Entity"
      }
    },
    "relations": {
      "type": "array",
      "maxItems": 4000,
      "items": {
        "$ref": "#/$defs/Relation"
      }
    }
  },
  "required": [
    "schema_version",
    "title",
    "entities",
    "relations"
  ],
  "$defs": {
    "Domain": {
      "type": "object",
      "additionalProperties": false,
      "properties": {
        "id": {
          "type": "string",
          "minLength": 1
        },
        "label": {
          "type": "string",
          "minLength": 1
        },
        "provenance": {
          "type": "string",
          "enum": [
            "fixture",
            "user",
            "codex"
          ]
        },
        "type": {
          "type": "string",
          "enum": [
            "Domain"
          ]
        },
        "description": {
          "type": "string"
        }
      },
      "required": [
        "id",
        "label",
        "provenance",
        "type",
        "description"
      ]
    },
    "Concept": {
      "type": "object",
      "additionalProperties": false,
      "properties": {
        "id": {
          "type": "string",
          "minLength": 1
        },
        "label": {
          "type": "string",
          "minLength": 1
        },
        "provenance": {
          "type": "string",
          "enum": [
            "fixture",
            "user",
            "codex"
          ]
        },
        "type": {
          "type": "string",
          "enum": [
            "Concept"
          ]
        },
        "description": {
          "type": "string"
        }
      },
      "required": [
        "id",
        "label",
        "provenance",
        "type",
        "description"
      ]
    },
    "Issue": {
      "type": "object",
      "additionalProperties": false,
      "properties": {
        "id": {
          "type": "string",
          "minLength": 1
        },
        "label": {
          "type": "string",
          "minLength": 1
        },
        "provenance": {
          "type": "string",
          "enum": [
            "fixture",
            "user",
            "codex"
          ]
        },
        "type": {
          "type": "string",
          "enum": [
            "Issue"
          ]
        },
        "description": {
          "type": "string"
        },
        "kind": {
          "type": "string",
          "enum": [
            "fundamental",
            "subproblem",
            "method_dependent"
          ]
        },
        "english_terms": {
          "type": "array",
          "items": {
            "type": "string",
            "minLength": 1
          },
          "uniqueItems": true,
          "maxItems": 5
        }
      },
      "required": [
        "id",
        "label",
        "provenance",
        "type",
        "description",
        "kind"
      ]
    },
    "Method": {
      "type": "object",
      "additionalProperties": false,
      "properties": {
        "id": {
          "type": "string",
          "minLength": 1
        },
        "label": {
          "type": "string",
          "minLength": 1
        },
        "provenance": {
          "type": "string",
          "enum": [
            "fixture",
            "user",
            "codex"
          ]
        },
        "type": {
          "type": "string",
          "enum": [
            "Method"
          ]
        },
        "description": {
          "type": "string"
        }
      },
      "required": [
        "id",
        "label",
        "provenance",
        "type",
        "description"
      ]
    },
    "Paper": {
      "type": "object",
      "additionalProperties": false,
      "properties": {
        "id": {
          "type": "string",
          "minLength": 1
        },
        "label": {
          "type": "string",
          "minLength": 1
        },
        "provenance": {
          "type": "string",
          "enum": [
            "fixture",
            "user",
            "codex"
          ]
        },
        "type": {
          "type": "string",
          "enum": [
            "Paper"
          ]
        },
        "title": {
          "type": "string",
          "minLength": 1
        },
        "year": {
          "type": [
            "integer",
            "null"
          ],
          "minimum": 1900,
          "maximum": 2200
        },
        "venue": {
          "type": [
            "string",
            "null"
          ]
        },
        "venue_type": {
          "enum": [
            "conference",
            "journal",
            "preprint",
            "other",
            null
          ]
        },
        "one_line_summary": {
          "type": "string"
        },
        "abstract": {
          "type": [
            "string",
            "null"
          ]
        },
        "abstract_source_url": {
          "type": [
            "string",
            "null"
          ],
          "format": "uri"
        },
        "abstract_ja": {
          "type": [
            "string",
            "null"
          ]
        },
        "reading": {
          "anyOf": [
            {
              "$ref": "#/$defs/Reading"
            },
            {
              "type": "null"
            }
          ]
        },
        "citation_count": {
          "type": [
            "integer",
            "null"
          ],
          "minimum": 0
        },
        "citation_source": {
          "type": [
            "string",
            "null"
          ]
        },
        "citation_as_of": {
          "type": [
            "string",
            "null"
          ],
          "format": "date"
        },
        "doi": {
          "type": [
            "string",
            "null"
          ]
        },
        "arxiv_id": {
          "type": [
            "string",
            "null"
          ]
        },
        "url": {
          "type": [
            "string",
            "null"
          ],
          "format": "uri"
        },
        "authors": {
          "type": "array",
          "items": {
            "type": "string",
            "minLength": 1
          }
        },
        "proposes": {
          "type": "array",
          "items": {
            "type": "string",
            "minLength": 1
          },
          "uniqueItems": true
        },
        "addresses": {
          "type": "array",
          "items": {
            "type": "string",
            "minLength": 1
          },
          "uniqueItems": true
        },
        "claims": {
          "type": "array",
          "items": {
            "type": "string",
            "minLength": 1
          },
          "uniqueItems": true
        },
        "evidence": {
          "type": "array",
          "items": {
            "type": "string",
            "minLength": 1
          },
          "uniqueItems": true
        },
        "code_availability": {
          "type": "string",
          "enum": [
            "public",
            "not_found",
            "unknown"
          ]
        },
        "code_url": {
          "type": [
            "string",
            "null"
          ],
          "format": "uri"
        },
        "code_checked_at": {
          "type": [
            "string",
            "null"
          ],
          "format": "date"
        },
        "representative_figure": {
          "anyOf": [
            {
              "$ref": "#/$defs/Figure"
            },
            {
              "type": "null"
            }
          ]
        }
      },
      "required": [
        "id",
        "label",
        "provenance",
        "type",
        "title",
        "year",
        "venue",
        "venue_type",
        "one_line_summary",
        "citation_count",
        "citation_source",
        "citation_as_of",
        "doi",
        "arxiv_id",
        "url",
        "authors",
        "proposes",
        "addresses",
        "claims",
        "evidence"
      ]
    },
    "Claim": {
      "type": "object",
      "additionalProperties": false,
      "properties": {
        "id": {
          "type": "string",
          "minLength": 1
        },
        "label": {
          "type": "string",
          "minLength": 1
        },
        "provenance": {
          "type": "string",
          "enum": [
            "fixture",
            "user",
            "codex"
          ]
        },
        "type": {
          "type": "string",
          "enum": [
            "Claim"
          ]
        },
        "statement": {
          "type": "string",
          "minLength": 1
        },
        "status": {
          "type": "string",
          "enum": [
            "open",
            "partially_solved",
            "solved",
            "disputed",
            "unknown"
          ]
        },
        "scope": {
          "type": "object",
          "additionalProperties": false,
          "properties": {
            "task": {
              "type": "string"
            },
            "setting": {
              "type": "string"
            },
            "metric": {
              "type": "string"
            },
            "assumptions": {
              "type": "array",
              "items": {
                "type": "string",
                "minLength": 1
              }
            },
            "limitations": {
              "type": "array",
              "items": {
                "type": "string",
                "minLength": 1
              }
            }
          },
          "required": [
            "task",
            "setting",
            "metric",
            "assumptions",
            "limitations"
          ]
        },
        "as_of": {
          "type": [
            "string",
            "null"
          ],
          "format": "date"
        },
        "evidence": {
          "type": "array",
          "items": {
            "type": "string",
            "minLength": 1
          },
          "uniqueItems": true
        }
      },
      "required": [
        "id",
        "label",
        "provenance",
        "type",
        "statement",
        "status",
        "scope",
        "as_of",
        "evidence"
      ]
    },
    "Evidence": {
      "type": "object",
      "additionalProperties": false,
      "properties": {
        "id": {
          "type": "string",
          "minLength": 1
        },
        "label": {
          "type": "string",
          "minLength": 1
        },
        "provenance": {
          "type": "string",
          "enum": [
            "fixture",
            "user",
            "codex"
          ]
        },
        "type": {
          "type": "string",
          "enum": [
            "Evidence"
          ]
        },
        "source_url": {
          "type": "string",
          "format": "uri"
        },
        "locator": {
          "type": "string",
          "minLength": 1
        },
        "excerpt": {
          "type": "string"
        },
        "verification": {
          "type": "string",
          "enum": [
            "unverified",
            "abstract_only",
            "verified"
          ]
        },
        "retrieved_at": {
          "type": [
            "string",
            "null"
          ],
          "format": "date-time"
        },
        "content_hash": {
          "type": [
            "string",
            "null"
          ]
        }
      },
      "required": [
        "id",
        "label",
        "provenance",
        "type",
        "source_url",
        "locator",
        "excerpt",
        "verification",
        "retrieved_at",
        "content_hash"
      ]
    },
    "Keyword": {
      "type": "object",
      "additionalProperties": false,
      "properties": {
        "id": {
          "type": "string",
          "minLength": 1
        },
        "label": {
          "type": "string",
          "minLength": 1
        },
        "provenance": {
          "type": "string",
          "enum": [
            "fixture",
            "user",
            "codex"
          ]
        },
        "type": {
          "type": "string",
          "enum": [
            "Keyword"
          ]
        },
        "aliases": {
          "type": "array",
          "items": {
            "type": "string",
            "minLength": 1
          },
          "uniqueItems": true
        },
        "category": {
          "type": "string",
          "enum": [
            "dataset",
            "benchmark",
            "hardware",
            "simulator",
            "metric",
            "sota",
            "model",
            "baseline",
            "task",
            "concept",
            "method",
            "other"
          ]
        },
        "meaning": {
          "type": "string",
          "minLength": 1
        },
        "papers": {
          "type": "array",
          "items": {
            "type": "string",
            "minLength": 1
          },
          "uniqueItems": true
        },
        "related": {
          "type": "array",
          "items": {
            "type": "string",
            "minLength": 1
          },
          "uniqueItems": true
        },
        "official_url": {
          "type": [
            "string",
            "null"
          ],
          "format": "uri"
        },
        "as_of": {
          "type": [
            "string",
            "null"
          ],
          "format": "date"
        },
        "definition_excerpt": {
          "type": "string"
        },
        "source_url": {
          "type": [
            "string",
            "null"
          ],
          "format": "uri"
        },
        "locator": {
          "type": [
            "string",
            "null"
          ]
        }
      },
      "required": [
        "id",
        "label",
        "provenance",
        "type",
        "aliases",
        "category",
        "meaning",
        "papers",
        "related",
        "definition_excerpt",
        "source_url",
        "locator"
      ]
    },
    "Entity": {
      "anyOf": [
        {
          "$ref": "#/$defs/Domain"
        },
        {
          "$ref": "#/$defs/Concept"
        },
        {
          "$ref": "#/$defs/Issue"
        },
        {
          "$ref": "#/$defs/Method"
        },
        {
          "$ref": "#/$defs/Paper"
        },
        {
          "$ref": "#/$defs/Claim"
        },
        {
          "$ref": "#/$defs/Evidence"
        },
        {
          "$ref": "#/$defs/Keyword"
        }
      ]
    },
    "Relation": {
      "type": "object",
      "additionalProperties": false,
      "properties": {
        "id": {
          "type": "string",
          "minLength": 1
        },
        "type": {
          "type": "string",
          "enum": [
            "part_of",
            "specializes",
            "depends_on",
            "related_to",
            "caused_by",
            "tradeoff_with",
            "addresses",
            "extends",
            "builds_on",
            "introduces_issue",
            "assumes",
            "instance_of",
            "proposes",
            "supports",
            "contradicts",
            "refines",
            "about"
          ]
        },
        "from": {
          "type": "string",
          "minLength": 1
        },
        "to": {
          "type": "string",
          "minLength": 1
        }
      },
      "required": [
        "id",
        "type",
        "from",
        "to"
      ]
    },
    "Figure": {
      "type": "object",
      "additionalProperties": false,
      "properties": {
        "asset_id": {
          "type": "string",
          "pattern": "^[a-f0-9]{64}$"
        },
        "caption": {
          "type": "string",
          "minLength": 1
        },
        "source_name": {
          "type": "string",
          "minLength": 1
        },
        "source_url": {
          "type": [
            "string",
            "null"
          ],
          "format": "uri"
        },
        "source_pdf_sha256": {
          "type": "string",
          "pattern": "^[a-f0-9]{64}$"
        },
        "page": {
          "type": "integer",
          "minimum": 1
        },
        "crop": {
          "type": "object",
          "additionalProperties": false,
          "properties": {
            "x": {
              "type": "number",
              "minimum": 0,
              "maximum": 1
            },
            "y": {
              "type": "number",
              "minimum": 0,
              "maximum": 1
            },
            "width": {
              "type": "number",
              "minimum": 1e-06,
              "maximum": 1
            },
            "height": {
              "type": "number",
              "minimum": 1e-06,
              "maximum": 1
            }
          },
          "required": [
            "x",
            "y",
            "width",
            "height"
          ]
        },
        "extracted_at": {
          "type": "string",
          "format": "date-time"
        }
      },
      "required": [
        "asset_id",
        "caption",
        "source_name",
        "source_url",
        "source_pdf_sha256",
        "page",
        "crop",
        "extracted_at"
      ]
    },
    "Reading": {
      "type": "object",
      "additionalProperties": false,
      "properties": {
        "contributions": {
          "type": "array",
          "items": {
            "type": "string",
            "minLength": 1
          }
        },
        "novelty": {
          "type": "string"
        },
        "key_idea": {
          "type": "string"
        },
        "validation": {
          "type": "string"
        },
        "discussion": {
          "type": "string"
        },
        "key_figures": {
          "type": "array",
          "items": {
            "type": "string",
            "minLength": 1
          }
        },
        "sources": {
          "type": "array",
          "items": {
            "type": "object",
            "additionalProperties": false,
            "properties": {
              "url": {
                "type": "string",
                "format": "uri"
              },
              "locator": {
                "type": "string",
                "minLength": 1
              }
            },
            "required": [
              "url",
              "locator"
            ]
          }
        }
      },
      "required": [
        "contributions",
        "novelty",
        "key_idea",
        "validation",
        "discussion",
        "key_figures"
      ]
    }
  }
}
