{
  "schema_version": "0.1.0",
  "title": "Multi-Agent Path Finding",
  "entities": [
    {
      "id": "mapf",
      "label": "MAPF",
      "provenance": "fixture",
      "type": "Domain",
      "description": "複数エージェントの経路計画。UIとスキーマを試すサンプルです。"
    },
    {
      "id": "collision",
      "label": "衝突のない経路計画",
      "provenance": "fixture",
      "type": "Issue",
      "description": "複数のエージェントが衝突せずに目的地へ到達する経路を求める。",
      "kind": "fundamental",
      "english_terms": [
        "multi-agent path finding (MAPF)",
        "collision-free paths"
      ]
    },
    {
      "id": "scalability",
      "label": "エージェント数へのスケーラビリティ",
      "provenance": "fixture",
      "type": "Issue",
      "description": "エージェント数や競合の増加に対して探索をどう抑えるか。",
      "kind": "subproblem",
      "english_terms": [
        "scalability",
        "large numbers of agents"
      ]
    },
    {
      "id": "optimality",
      "label": "最適性と計算時間",
      "provenance": "fixture",
      "type": "Issue",
      "description": "最適解の保証と、実用的な計算時間の間にあるトレードオフ。",
      "kind": "subproblem",
      "english_terms": [
        "optimality",
        "bounded suboptimality"
      ]
    },
    {
      "id": "tree",
      "label": "制約木の増大",
      "provenance": "fixture",
      "type": "Issue",
      "description": "CBSの競合解消で探索する制約木が増大する問題。",
      "kind": "method_dependent",
      "english_terms": [
        "constraint tree (CT)"
      ]
    },
    {
      "id": "cbs",
      "label": "CBS",
      "provenance": "fixture",
      "type": "Method",
      "description": "競合を検出し、高レベルの制約木で解消する探索手法。"
    },
    {
      "id": "ecbs",
      "label": "ECBS",
      "provenance": "fixture",
      "type": "Method",
      "description": "bounded-suboptimalな探索を用いるCBSの系統。表示確認用。"
    },
    {
      "id": "family-cbs",
      "label": "コンフリクトベース探索（CBS系）",
      "provenance": "fixture",
      "type": "Concept",
      "description": "衝突ごとに制約を加えて探索木を分岐し、各エージェントは単独で経路を探す2段階の探索。最適解を求める系統（CBS・ICBS）と、解の質の上限を保って速くする準最適の系統（ECBS・EECBS）がある。"
    },
    {
      "id": "paper-cbs",
      "label": "CBS (2015)",
      "provenance": "fixture",
      "type": "Paper",
      "title": "Conflict-based search for optimal multi-agent pathfinding",
      "year": 2015,
      "venue": "AIJ",
      "venue_type": "journal",
      "one_line_summary": "競合を制約木で解消するMAPF探索。サンプルの要約は本文未検証。",
      "reading": {
        "contributions": [
          "衝突ごとに制約を加える上位の探索（制約木）と、各エージェント単独の下位の探索に分けた2段階の最適MAPFソルバCBSを提案",
          "CBSが和コスト（Sum-of-costs）について最適かつ完全であることを示した",
          "衝突の多いエージェントを統合するMA-CBS（Meta-Agent CBS）への一般化"
        ],
        "novelty": "A*系の手法のようにエージェントを結合した状態空間を探索しないため、ボトルネックが多く衝突の少ない地図で大幅に速い。",
        "key_idea": "2エージェントが同じ時刻に同じ場所を使う衝突を見つけたら、どちらかに制約を課す2つの子ノードへ分岐し、各エージェントは制約の下で単独に最短経路を探す。",
        "validation": "グリッド地図とゲーム（Dragon Age: Origins）の地図で、A*系の手法やICTSと成功率・実行時間を比較した。",
        "discussion": "開けた地図で衝突が多いと制約木が指数的に大きくなり遅くなる。MA-CBSで緩和するが、統合の閾値の選び方に性能が依存する。評価は4近傍のグリッドが中心。",
        "key_figures": [
          "制約木（CT）の展開例：衝突から2つの子ノードへの分岐"
        ]
      },
      "citation_count": null,
      "citation_source": null,
      "citation_as_of": null,
      "doi": "10.1016/j.artint.2014.11.006",
      "arxiv_id": null,
      "url": "https://doi.org/10.1016/j.artint.2014.11.006",
      "authors": [
        "Guni Sharon",
        "Roni Stern",
        "Ariel Felner",
        "Nathan R. Sturtevant"
      ],
      "proposes": [
        "cbs"
      ],
      "addresses": [
        "collision",
        "optimality"
      ],
      "claims": [
        "claim-cbs"
      ],
      "evidence": [
        "evidence-cbs"
      ],
      "code_availability": "unknown",
      "code_url": null,
      "code_checked_at": null
    },
    {
      "id": "claim-cbs",
      "label": "所定の条件下で最適な解を探索",
      "provenance": "fixture",
      "type": "Claim",
      "statement": "CBSの最適性保証について検証するためのサンプル主張。原文照合は未実施。",
      "status": "unknown",
      "scope": {
        "task": "MAPF",
        "setting": "離散グラフ上の衝突回避",
        "metric": "sum-of-costs",
        "assumptions": [
          "低レベル探索が最適解を返すことを確認する"
        ],
        "limitations": [
          "このサンプルでは本文を検証していない"
        ]
      },
      "as_of": null,
      "evidence": [
        "evidence-cbs"
      ]
    },
    {
      "id": "evidence-cbs",
      "label": "CBS論文の参照先",
      "provenance": "fixture",
      "type": "Evidence",
      "source_url": "https://doi.org/10.1016/j.artint.2014.11.006",
      "locator": "論文参照先のみ。本文のページ・節は未取得",
      "excerpt": "",
      "verification": "unverified",
      "retrieved_at": null,
      "content_hash": null
    },
    {
      "id": "icbs",
      "type": "Method",
      "label": "ICBS",
      "description": "競合の優先順位づけなどの改良を組み合わせたCBS。",
      "provenance": "fixture"
    },
    {
      "id": "eecbs",
      "type": "Method",
      "label": "EECBS",
      "description": "オンラインで得たコスト見積もりを用いて探索するbounded-suboptimalなCBS。",
      "provenance": "fixture"
    },
    {
      "id": "paper-cbs-2012",
      "label": "CBS · AAAI 2012",
      "provenance": "fixture",
      "type": "Paper",
      "title": "Conflict-Based Search For Optimal Multi-Agent Path Finding",
      "year": 2012,
      "venue": "AAAI",
      "venue_type": "conference",
      "one_line_summary": "エージェントごとの経路探索と競合解消を二段階で行うCBSを提案。",
      "citation_count": null,
      "citation_source": null,
      "citation_as_of": null,
      "doi": "10.1609/aaai.v26i1.8140",
      "arxiv_id": null,
      "url": "https://ojs.aaai.org/index.php/AAAI/article/view/8140",
      "authors": [
        "Guni Sharon",
        "Roni Stern",
        "Ariel Felner",
        "Nathan R. Sturtevant"
      ],
      "proposes": [
        "cbs"
      ],
      "addresses": [
        "collision",
        "scalability"
      ],
      "claims": [],
      "evidence": [],
      "code_availability": "unknown",
      "code_url": null,
      "code_checked_at": null
    },
    {
      "id": "paper-ecbs",
      "label": "ECBS · SoCS 2014",
      "provenance": "fixture",
      "type": "Paper",
      "title": "Suboptimal Variants of the Conflict-Based Search Algorithm for the Multi-Agent Pathfinding Problem",
      "year": 2014,
      "venue": "SoCS",
      "venue_type": "conference",
      "one_line_summary": "CBSの最適性条件を緩め、解の品質と計算時間を調整する探索法。",
      "citation_count": null,
      "citation_source": null,
      "citation_as_of": null,
      "doi": "10.1609/socs.v5i1.18315",
      "arxiv_id": null,
      "url": "https://ojs.aaai.org/index.php/SOCS/article/view/18315",
      "authors": [
        "Max Barer",
        "Guni Sharon",
        "Roni Stern",
        "Ariel Felner"
      ],
      "proposes": [
        "ecbs"
      ],
      "addresses": [
        "collision",
        "scalability"
      ],
      "claims": [],
      "evidence": [],
      "code_availability": "unknown",
      "code_url": null,
      "code_checked_at": null
    },
    {
      "id": "paper-icbs",
      "label": "ICBS · IJCAI 2015",
      "provenance": "fixture",
      "type": "Paper",
      "title": "ICBS: Improved Conflict-Based Search Algorithm for Multi-Agent Pathfinding",
      "year": 2015,
      "venue": "IJCAI",
      "venue_type": "conference",
      "one_line_summary": "競合の優先順位づけとmerge-and-restartを既存のCBS改善と組み合わせる。",
      "citation_count": null,
      "citation_source": null,
      "citation_as_of": null,
      "doi": null,
      "arxiv_id": null,
      "url": "https://www.ijcai.org/Proceedings/15/Papers/110.pdf",
      "authors": [
        "Eli Boyarski",
        "Ariel Felner",
        "Roni Stern",
        "Guni Sharon",
        "David Tolpin",
        "Oded Betzalel",
        "Eyal Shimony"
      ],
      "proposes": [
        "icbs"
      ],
      "addresses": [
        "collision",
        "scalability"
      ],
      "claims": [],
      "evidence": [],
      "code_availability": "unknown",
      "code_url": null,
      "code_checked_at": null
    },
    {
      "id": "paper-eecbs",
      "label": "EECBS · AAAI 2021",
      "provenance": "fixture",
      "type": "Paper",
      "title": "EECBS: A Bounded-Suboptimal Search for Multi-Agent Path Finding",
      "year": 2021,
      "venue": "AAAI",
      "venue_type": "conference",
      "one_line_summary": "オンラインのコスト見積もりとExplicit Estimation SearchをCBSへ適用。",
      "citation_count": null,
      "citation_source": null,
      "citation_as_of": null,
      "doi": "10.1609/aaai.v35i14.17466",
      "arxiv_id": null,
      "url": "https://ojs.aaai.org/index.php/AAAI/article/view/17466",
      "authors": [
        "Jiaoyang Li",
        "Wheeler Ruml",
        "Sven Koenig"
      ],
      "proposes": [
        "eecbs"
      ],
      "addresses": [
        "collision",
        "scalability"
      ],
      "claims": [],
      "evidence": [],
      "code_availability": "public",
      "code_url": "https://github.com/Jiaoyang-Li/EECBS",
      "code_checked_at": "2026-10-12"
    },
    {
      "id": "kw-soc",
      "label": "Sum-of-costs",
      "provenance": "fixture",
      "type": "Keyword",
      "aliases": [
        "SOC"
      ],
      "category": "metric",
      "meaning": "全エージェントの経路コスト（ゴールに着くまでの時間ステップ数など）の合計。CBS・ECBS・EECBSのいずれもこのコストで解の良さを測る。",
      "papers": [
        "paper-cbs",
        "paper-ecbs",
        "paper-eecbs"
      ],
      "related": [
        "optimality"
      ],
      "definition_excerpt": "",
      "source_url": null,
      "locator": null
    },
    {
      "id": "kw-mapf-benchmark",
      "label": "MAPFベンチマーク（Moving AI Lab）",
      "provenance": "fixture",
      "type": "Keyword",
      "aliases": [
        "MAPF benchmarks",
        "MovingAI"
      ],
      "category": "benchmark",
      "meaning": "MAPF用のグリッド地図と問題を集めたベンチマーク。手法どうしを同じ問題で比べるときによく使われる。",
      "papers": [],
      "related": [
        "mapf",
        "scalability"
      ],
      "definition_excerpt": "The goal of this page is to collect benchmark problems and maps that can be broadly used and referenced for comparison and testing purposes.",
      "source_url": "https://movingai.com/benchmarks/mapf.html",